{
  "$schema": "https://json-schema.org/draft/2020-12/schema",
  "$id": "https://misofm.example/schema/session-v1.schema.json",
  "title": "MisoFM Session V1",
  "type": "object",
  "additionalProperties": false,
  "required": ["schema_version", "session_id", "revision", "sample_rate_hz", "quantum_frames", "render_profile", "output_profile", "sources", "console", "tracks", "submixes", "vcas", "control_smoothing", "outputs", "routes", "automation"],
  "properties": {
    "schema_version": { "const": 1 },
    "session_id": { "$ref": "#/$defs/id" },
    "revision": { "$ref": "#/$defs/revision" },
    "sample_rate_hz": { "enum": [44100, 48000, 88200, 96000] },
    "quantum_frames": { "$ref": "#/$defs/u32" },
    "render_profile": { "$ref": "#/$defs/render_profile" },
    "output_profile": { "$ref": "#/$defs/output_profile" },
    "sources": { "type": "array", "items": { "$ref": "#/$defs/source" } },
    "console": { "$ref": "#/$defs/console" },
    "tracks": { "type": "array", "items": { "$ref": "#/$defs/track" } },
    "submixes": { "type": "array", "items": { "$ref": "#/$defs/submix" } },
    "vcas": { "type": "array", "items": { "$ref": "#/$defs/vca" } },
    "control_smoothing": { "$ref": "#/$defs/control_smoothing" },
    "outputs": { "type": "array", "items": { "$ref": "#/$defs/id_record" } },
    "routes": { "type": "array", "items": { "$ref": "#/$defs/route" } },
    "automation": { "type": "array", "items": { "$ref": "#/$defs/automation" } }
  },
  "$defs": {
    "id": { "type": "string", "pattern": "^[a-z][a-z0-9._-]{0,126}$" },
    "u8": { "type": "integer", "minimum": 0, "maximum": 255 },
    "u32": { "type": "integer", "minimum": 0, "maximum": 4294967295 },
    "u64": {
      "type": "string",
      "pattern": "^(?:0|[1-9][0-9]{0,18}|(?:1[0-7][0-9]{18}|18[0-3][0-9]{17}|184[0-3][0-9]{16}|1844[0-5][0-9]{15}|18446[0-6][0-9]{14}|184467[0-3][0-9]{13}|1844674[0-3][0-9]{12}|184467440[0-6][0-9]{10}|1844674407[0-2][0-9]{9}|18446744073[0-6][0-9]{8}|1844674407370[0-8][0-9]{6}|18446744073709[0-4][0-9]{5}|184467440737095[0-4][0-9]{4}|18446744073709550[0-9]{3}|18446744073709551[0-5][0-9]{2}|1844674407370955160[0-9]|1844674407370955161[0-4]|18446744073709551615))$"
    },
    "revision": {
      "type": "string",
      "pattern": "^(?:0|[1-9][0-9]{0,17}|[1-8][0-9]{18}|9[0-1][0-9]{17}|92[0-1][0-9]{16}|922[0-2][0-9]{15}|9223[0-2][0-9]{14}|92233[0-6][0-9]{13}|922337[0-1][0-9]{12}|92233720[0-2][0-9]{10}|922337203[0-5][0-9]{9}|9223372036[0-7][0-9]{8}|92233720368[0-4][0-9]{7}|922337203685[0-3][0-9]{6}|9223372036854[0-6][0-9]{5}|92233720368547[0-6][0-9]{4}|922337203685477[0-4][0-9]{3}|9223372036854775[0-7][0-9]{2}|922337203685477580[0-6]|9223372036854775807)$"
    },
    "f32": { "type": "number" },
    "channel": { "enum": ["left", "right", "both"] },
    "unit": { "enum": ["db", "hz", "milliseconds", "samples", "linear", "ratio"] },
    "render_profile": {
      "type": "object", "additionalProperties": false, "required": ["id", "mode"],
      "properties": { "id": { "$ref": "#/$defs/id" }, "mode": { "const": "single_thread" } }
    },
    "output_profile": {
      "type": "object", "additionalProperties": false, "required": ["id", "channels", "sample_format"],
      "properties": { "id": { "$ref": "#/$defs/id" }, "channels": { "const": 2 }, "sample_format": { "const": "f32_planar" } }
    },
    "source": {
      "type": "object", "additionalProperties": false, "required": ["id", "content", "channels", "bit_depth", "frames"],
      "properties": {
        "id": { "$ref": "#/$defs/id" }, "content": { "type": "string", "pattern": "^blake3:[0-9a-f]{64}$" },
        "channels": { "$ref": "#/$defs/u8" }, "bit_depth": { "enum": [16, 24, "32f"] }, "frames": { "$ref": "#/$defs/u64" }
      }
    },
    "id_record": {
      "type": "object", "additionalProperties": false, "required": ["id"], "properties": { "id": { "$ref": "#/$defs/id" } }
    },
    "channel_builtins": {
      "type": "object", "additionalProperties": false, "required": ["polarity_invert", "trim_db", "hpf_hz", "lpf_hz", "delay_samples"],
      "properties": {
        "polarity_invert": { "type": "boolean" }, "trim_db": { "$ref": "#/$defs/f32" }, "hpf_hz": { "$ref": "#/$defs/f32" },
        "lpf_hz": { "$ref": "#/$defs/f32" }, "delay_samples": { "type": "integer", "minimum": 0, "maximum": 48000 }
      }
    },
    "builtins": {
      "type": "object", "additionalProperties": false, "required": ["left", "right"],
      "properties": { "left": { "$ref": "#/$defs/channel_builtins" }, "right": { "$ref": "#/$defs/channel_builtins" } }
    },
    "console_slot": {
      "type": "object", "additionalProperties": false, "required": ["slot", "identity", "quality", "link_mode"],
      "properties": {
        "slot": { "$ref": "#/$defs/id" },
        "identity": { "type": "object", "additionalProperties": false, "required": ["kind", "effect_id"], "properties": { "kind": { "const": "native" }, "effect_id": { "$ref": "#/$defs/id" } } },
        "quality": { "enum": ["draft", "normal", "high"] }, "link_mode": { "enum": ["dual_mono", "maximum", "average"] }
      }
    },
    "console": {
      "type": "object", "additionalProperties": false, "required": ["pre_insert", "post_insert"],
      "properties": { "pre_insert": { "type": "array", "items": { "$ref": "#/$defs/console_slot" } }, "post_insert": { "type": "array", "items": { "$ref": "#/$defs/console_slot" } } }
    },
    "console_entry": {
      "type": "object", "additionalProperties": false, "required": ["slot", "bypass", "params"],
      "properties": { "slot": { "$ref": "#/$defs/id" }, "bypass": { "type": "boolean" }, "params": { "type": "array", "items": { "$ref": "#/$defs/effect_param" } } }
    },
    "rack": {
      "type": "object", "additionalProperties": false, "required": ["effects"],
      "properties": { "effects": { "type": "array", "items": { "$ref": "#/$defs/effect" } } }
    },
    "effect_identity": {
      "oneOf": [
        { "type": "object", "additionalProperties": false, "required": ["kind", "effect_id"], "properties": { "kind": { "const": "native" }, "effect_id": { "$ref": "#/$defs/id" } } },
        { "type": "object", "additionalProperties": false, "required": ["kind", "cid"], "properties": { "kind": { "const": "cid" }, "cid": { "type": "string", "minLength": 1 } } }
      ]
    },
    "effect_param": {
      "type": "object", "additionalProperties": false, "required": ["parameter_id", "channel", "unit", "value"],
      "properties": { "parameter_id": { "$ref": "#/$defs/u32" }, "channel": { "$ref": "#/$defs/channel" }, "unit": { "$ref": "#/$defs/unit" }, "value": { "$ref": "#/$defs/f32" } }
    },
    "route_source": {
      "oneOf": [
        { "type": "object", "additionalProperties": false, "required": ["kind", "track_id", "tap"], "properties": { "kind": { "const": "track" }, "track_id": { "$ref": "#/$defs/id" }, "tap": { "enum": ["input", "post_input", "insert_send", "insert_return", "pre_fader", "post_fader", "post_pan"] } } },
        { "type": "object", "additionalProperties": false, "required": ["kind", "submix_id", "tap"], "properties": { "kind": { "const": "submix" }, "submix_id": { "$ref": "#/$defs/id" }, "tap": { "enum": ["input", "post_input", "insert_send", "insert_return", "pre_fader", "post_fader", "post_pan"] } } }
      ]
    },
    "sidechain": {
      "oneOf": [
        { "type": "object", "additionalProperties": false, "required": ["kind"], "properties": { "kind": { "const": "none" } } },
        { "type": "object", "additionalProperties": false, "required": ["kind", "source", "port_id"], "properties": { "kind": { "const": "routed" }, "source": { "$ref": "#/$defs/route_source" }, "port_id": { "$ref": "#/$defs/id" } } }
      ]
    },
    "effect": {
      "type": "object", "additionalProperties": false, "required": ["id", "identity", "quality", "bypass", "link_mode", "params", "sidechain"],
      "properties": {
        "id": { "$ref": "#/$defs/id" }, "identity": { "$ref": "#/$defs/effect_identity" }, "quality": { "enum": ["draft", "normal", "high"] },
        "bypass": { "type": "boolean" }, "link_mode": { "enum": ["dual_mono", "maximum", "average"] },
        "params": { "type": "array", "items": { "$ref": "#/$defs/effect_param" } }, "sidechain": { "$ref": "#/$defs/sidechain" }
      }
    },
    "fader": {
      "type": "object", "additionalProperties": false, "required": ["left_db", "right_db", "left_mute", "right_mute"],
      "properties": { "left_db": { "$ref": "#/$defs/f32" }, "right_db": { "$ref": "#/$defs/f32" }, "left_mute": { "type": "boolean" }, "right_mute": { "type": "boolean" } }
    },
    "pan": {
      "type": "object", "additionalProperties": false, "required": ["left", "right", "smoothing_samples"],
      "properties": { "left": { "$ref": "#/$defs/f32" }, "right": { "$ref": "#/$defs/f32" }, "smoothing_samples": { "$ref": "#/$defs/u32" } }
    },
    "matrix": {
      "type": "object", "additionalProperties": false, "required": ["ll", "lr", "rl", "rr", "smoothing_samples"],
      "properties": { "ll": { "$ref": "#/$defs/f32" }, "lr": { "$ref": "#/$defs/f32" }, "rl": { "$ref": "#/$defs/f32" }, "rr": { "$ref": "#/$defs/f32" }, "smoothing_samples": { "$ref": "#/$defs/u32" } }
    },
    "track_base": {
      "type": "object", "additionalProperties": false, "properties": {
        "id": { "$ref": "#/$defs/id" }, "source_id": { "$ref": "#/$defs/id" }, "left_source_channel": { "$ref": "#/$defs/u8" }, "right_source_channel": { "$ref": "#/$defs/u8" },
        "builtins": { "$ref": "#/$defs/builtins" }, "console": { "type": "array", "items": { "$ref": "#/$defs/console_entry" } }, "inserts": { "$ref": "#/$defs/rack" }, "fader": { "$ref": "#/$defs/fader" }
      }
    },
    "track": {
      "oneOf": [
        { "type": "object", "additionalProperties": false, "required": ["id", "source_id", "left_source_channel", "right_source_channel", "builtins", "console", "inserts", "fader", "pan"], "properties": { "id": { "$ref": "#/$defs/id" }, "source_id": { "$ref": "#/$defs/id" }, "left_source_channel": { "$ref": "#/$defs/u8" }, "right_source_channel": { "$ref": "#/$defs/u8" }, "builtins": { "$ref": "#/$defs/builtins" }, "console": { "type": "array", "items": { "$ref": "#/$defs/console_entry" } }, "inserts": { "$ref": "#/$defs/rack" }, "fader": { "$ref": "#/$defs/fader" }, "pan": { "$ref": "#/$defs/pan" } } },
        { "type": "object", "additionalProperties": false, "required": ["id", "source_id", "left_source_channel", "right_source_channel", "builtins", "console", "inserts", "fader", "matrix"], "properties": { "id": { "$ref": "#/$defs/id" }, "source_id": { "$ref": "#/$defs/id" }, "left_source_channel": { "$ref": "#/$defs/u8" }, "right_source_channel": { "$ref": "#/$defs/u8" }, "builtins": { "$ref": "#/$defs/builtins" }, "console": { "type": "array", "items": { "$ref": "#/$defs/console_entry" } }, "inserts": { "$ref": "#/$defs/rack" }, "fader": { "$ref": "#/$defs/fader" }, "matrix": { "$ref": "#/$defs/matrix" } } }
      ]
    },
    "submix": {
      "oneOf": [
        { "type": "object", "additionalProperties": false, "required": ["id", "builtins", "console", "inserts", "fader", "pan"], "properties": { "id": { "$ref": "#/$defs/id" }, "builtins": { "$ref": "#/$defs/builtins" }, "console": { "type": "array", "items": { "$ref": "#/$defs/console_entry" } }, "inserts": { "$ref": "#/$defs/rack" }, "fader": { "$ref": "#/$defs/fader" }, "pan": { "$ref": "#/$defs/pan" } } },
        { "type": "object", "additionalProperties": false, "required": ["id", "builtins", "console", "inserts", "fader", "matrix"], "properties": { "id": { "$ref": "#/$defs/id" }, "builtins": { "$ref": "#/$defs/builtins" }, "console": { "type": "array", "items": { "$ref": "#/$defs/console_entry" } }, "inserts": { "$ref": "#/$defs/rack" }, "fader": { "$ref": "#/$defs/fader" }, "matrix": { "$ref": "#/$defs/matrix" } } }
      ]
    },
    "control_smoothing": {
      "oneOf": [
        { "type": "object", "additionalProperties": false, "required": ["kind"], "properties": { "kind": { "const": "default" } } },
        {
          "type": "object", "additionalProperties": false, "required": ["kind", "mute_ms", "fader_ms", "pan_ms"],
          "properties": {
            "kind": { "const": "explicit" },
            "mute_ms": { "type": "number", "minimum": 0, "maximum": 1000 },
            "fader_ms": { "type": "number", "minimum": 0, "maximum": 1000 },
            "pan_ms": { "type": "number", "minimum": 0, "maximum": 1000 }
          }
        }
      ]
    },
    "vca": {
      "type": "object", "additionalProperties": false, "required": ["id", "fader", "members"],
      "properties": {
        "id": { "$ref": "#/$defs/id" },
        "fader": {
          "type": "object", "additionalProperties": false, "required": ["left_db", "right_db", "left_mute", "right_mute"],
          "properties": {
            "left_db": { "type": "number", "minimum": -144, "maximum": 24 },
            "right_db": { "type": "number", "minimum": -144, "maximum": 24 },
            "left_mute": { "type": "boolean" },
            "right_mute": { "type": "boolean" }
          }
        },
        "members": { "type": "array", "items": { "$ref": "#/$defs/id" }, "uniqueItems": true }
      }
    },
    "route_destination": {
      "oneOf": [
        { "type": "object", "additionalProperties": false, "required": ["kind", "submix_id"], "properties": { "kind": { "const": "submix_input" }, "submix_id": { "$ref": "#/$defs/id" } } },
        { "type": "object", "additionalProperties": false, "required": ["kind", "output_id"], "properties": { "kind": { "const": "output_input" }, "output_id": { "$ref": "#/$defs/id" } } }
      ]
    },
    "channel_matrix": {
      "type": "object", "additionalProperties": false, "required": ["ll", "lr", "rl", "rr"],
      "properties": { "ll": { "$ref": "#/$defs/f32" }, "lr": { "$ref": "#/$defs/f32" }, "rl": { "$ref": "#/$defs/f32" }, "rr": { "$ref": "#/$defs/f32" } }
    },
    "route": {
      "type": "object", "additionalProperties": false, "required": ["id", "source", "destination", "channel_matrix", "gain_db", "mute", "follows_mute"],
      "properties": { "id": { "$ref": "#/$defs/id" }, "source": { "$ref": "#/$defs/route_source" }, "destination": { "$ref": "#/$defs/route_destination" }, "channel_matrix": { "$ref": "#/$defs/channel_matrix" }, "gain_db": { "$ref": "#/$defs/f32" }, "mute": { "type": "boolean" }, "follows_mute": { "type": "boolean" } },
      "if": { "properties": { "destination": { "properties": { "kind": { "const": "output_input" } } } } },
      "then": { "properties": { "follows_mute": { "const": false } } }
    },
    "automation_target": {
      "oneOf": [
        { "type": "object", "additionalProperties": false, "required": ["owner", "owner_id", "section", "control", "lane"],
          "properties": { "owner": { "enum": ["strip", "route", "vca"] }, "owner_id": { "$ref": "#/$defs/id" }, "section": { "enum": ["own", "builtins"] }, "control": { "$ref": "#/$defs/u32" }, "lane": { "$ref": "#/$defs/channel" } } },
        { "type": "object", "additionalProperties": false, "required": ["owner", "owner_id", "section", "slot_id", "control", "lane"],
          "properties": { "owner": { "const": "strip" }, "owner_id": { "$ref": "#/$defs/id" }, "section": { "enum": ["console", "inserts"] }, "slot_id": { "$ref": "#/$defs/id" }, "control": { "$ref": "#/$defs/u32" }, "lane": { "$ref": "#/$defs/channel" } } }
      ]
    },
    "automation_segment": {
      "type": "object", "additionalProperties": false, "required": ["shape", "start_sample", "end_sample", "start_value", "end_value", "unit"],
      "properties": { "shape": { "enum": ["step", "linear", "exponential"] }, "start_sample": { "$ref": "#/$defs/u64" }, "end_sample": { "$ref": "#/$defs/u64" }, "start_value": { "$ref": "#/$defs/f32" }, "end_value": { "$ref": "#/$defs/f32" }, "unit": { "$ref": "#/$defs/unit" } }
    },
    "automation_offset": {
      "type": "object", "additionalProperties": false, "required": ["left_db", "right_db"],
      "properties": { "left_db": { "$ref": "#/$defs/f32" }, "right_db": { "$ref": "#/$defs/f32" } }
    },
    "automation": {
      "type": "object", "additionalProperties": false, "required": ["id", "target", "segments", "offset"],
      "properties": { "id": { "$ref": "#/$defs/id" }, "target": { "$ref": "#/$defs/automation_target" }, "segments": { "type": "array", "items": { "$ref": "#/$defs/automation_segment" }, "minItems": 1 }, "offset": { "$ref": "#/$defs/automation_offset" } }
    }
  }
}
