{
  "schema_version": 1,
  "session_id": "observation-frame-shape",
  "revision": "1",
  "sample_rate_hz": 48000,
  "quantum_frames": 128,
  "render_profile": {
    "id": "native",
    "mode": "single_thread"
  },
  "output_profile": {
    "id": "main",
    "channels": 2,
    "sample_format": "f32_planar"
  },
  "sources": [
    {
      "id": "fixture-source",
      "content": "blake3:54d1d2e6f516e138da72f6f8afcee53056b74ee31ea367ae5a6b5798efe6bf12",
      "channels": 2,
      "bit_depth": "32f",
      "frames": "48000"
    }
  ],
  "console": {
    "pre_insert": [],
    "post_insert": []
  },
  "tracks": [
    {
      "id": "t0",
      "source_id": "fixture-source",
      "left_source_channel": 0,
      "right_source_channel": 1,
      "builtins": {
        "left": {
          "polarity_invert": false,
          "trim_db": 0.0,
          "hpf_hz": 0.0,
          "lpf_hz": 0.0,
          "delay_samples": 0
        },
        "right": {
          "polarity_invert": false,
          "trim_db": 0.0,
          "hpf_hz": 0.0,
          "lpf_hz": 0.0,
          "delay_samples": 0
        }
      },
      "console": [],
      "inserts": {
        "effects": [
          {
            "id": "comp",
            "identity": {
              "kind": "native",
              "effect_id": "miso.compressor"
            },
            "quality": "normal",
            "bypass": false,
            "link_mode": "dual_mono",
            "params": [
              {
                "parameter_id": 1,
                "channel": "both",
                "unit": "db",
                "value": -30.0
              },
              {
                "parameter_id": 2,
                "channel": "both",
                "unit": "ratio",
                "value": 4.0
              },
              {
                "parameter_id": 3,
                "channel": "both",
                "unit": "db",
                "value": 6.0
              },
              {
                "parameter_id": 4,
                "channel": "both",
                "unit": "milliseconds",
                "value": 10.0
              },
              {
                "parameter_id": 5,
                "channel": "both",
                "unit": "milliseconds",
                "value": 100.0
              },
              {
                "parameter_id": 6,
                "channel": "both",
                "unit": "db",
                "value": 0.0
              },
              {
                "parameter_id": 7,
                "channel": "both",
                "unit": "linear",
                "value": 1.0
              }
            ],
            "sidechain": {
              "kind": "none"
            }
          }
        ]
      },
      "fader": {
        "left_db": 0.0,
        "right_db": 0.0,
        "left_mute": false,
        "right_mute": false
      },
      "pan": {
        "left": -1.0,
        "right": 1.0,
        "smoothing_samples": 0
      }
    },
    {
      "id": "t1",
      "source_id": "fixture-source",
      "left_source_channel": 0,
      "right_source_channel": 1,
      "builtins": {
        "left": {
          "polarity_invert": false,
          "trim_db": 0.0,
          "hpf_hz": 0.0,
          "lpf_hz": 0.0,
          "delay_samples": 0
        },
        "right": {
          "polarity_invert": false,
          "trim_db": 0.0,
          "hpf_hz": 0.0,
          "lpf_hz": 0.0,
          "delay_samples": 0
        }
      },
      "console": [],
      "inserts": {
        "effects": [
          {
            "id": "eq",
            "identity": {
              "kind": "native",
              "effect_id": "miso.parametric-eq"
            },
            "quality": "normal",
            "bypass": false,
            "link_mode": "dual_mono",
            "params": [
              {
                "parameter_id": 1,
                "channel": "both",
                "unit": "linear",
                "value": 1.0
              },
              {
                "parameter_id": 2,
                "channel": "both",
                "unit": "linear",
                "value": 2.0
              },
              {
                "parameter_id": 3,
                "channel": "both",
                "unit": "hz",
                "value": 1000.0
              },
              {
                "parameter_id": 4,
                "channel": "both",
                "unit": "db",
                "value": 0.0
              }
            ],
            "sidechain": {
              "kind": "none"
            }
          }
        ]
      },
      "fader": {
        "left_db": 0.0,
        "right_db": 0.0,
        "left_mute": false,
        "right_mute": false
      },
      "pan": {
        "left": -1.0,
        "right": 1.0,
        "smoothing_samples": 0
      }
    },
    {
      "id": "t2",
      "source_id": "fixture-source",
      "left_source_channel": 0,
      "right_source_channel": 1,
      "builtins": {
        "left": {
          "polarity_invert": false,
          "trim_db": 0.0,
          "hpf_hz": 0.0,
          "lpf_hz": 0.0,
          "delay_samples": 0
        },
        "right": {
          "polarity_invert": false,
          "trim_db": 0.0,
          "hpf_hz": 0.0,
          "lpf_hz": 0.0,
          "delay_samples": 0
        }
      },
      "console": [],
      "inserts": {
        "effects": [
          {
            "id": "gate",
            "identity": {
              "kind": "native",
              "effect_id": "miso.gate-expander"
            },
            "quality": "normal",
            "bypass": false,
            "link_mode": "dual_mono",
            "params": [
              {
                "parameter_id": 1,
                "channel": "both",
                "unit": "db",
                "value": -6.0
              },
              {
                "parameter_id": 2,
                "channel": "both",
                "unit": "ratio",
                "value": 4.0
              },
              {
                "parameter_id": 3,
                "channel": "both",
                "unit": "db",
                "value": 40.0
              },
              {
                "parameter_id": 4,
                "channel": "both",
                "unit": "db",
                "value": 6.0
              },
              {
                "parameter_id": 5,
                "channel": "both",
                "unit": "milliseconds",
                "value": 1.0
              },
              {
                "parameter_id": 6,
                "channel": "both",
                "unit": "milliseconds",
                "value": 100.0
              },
              {
                "parameter_id": 7,
                "channel": "both",
                "unit": "milliseconds",
                "value": 100.0
              }
            ],
            "sidechain": {
              "kind": "none"
            }
          }
        ]
      },
      "fader": {
        "left_db": 0.0,
        "right_db": 0.0,
        "left_mute": false,
        "right_mute": false
      },
      "pan": {
        "left": -1.0,
        "right": 1.0,
        "smoothing_samples": 0
      }
    }
  ],
  "submixes": [],
  "vcas": [],
  "control_smoothing": {
    "kind": "default"
  },
  "outputs": [
    {
      "id": "main-out"
    }
  ],
  "routes": [
    {
      "id": "t0-main",
      "source": {
        "kind": "track",
        "track_id": "t0",
        "tap": "post_pan"
      },
      "destination": {
        "kind": "output_input",
        "output_id": "main-out"
      },
      "channel_matrix": {
        "ll": 1.0,
        "lr": 0.0,
        "rl": 0.0,
        "rr": 1.0
      },
      "gain_db": 0.0,
      "mute": false,
      "follows_mute": false
    },
    {
      "id": "t1-main",
      "source": {
        "kind": "track",
        "track_id": "t1",
        "tap": "post_pan"
      },
      "destination": {
        "kind": "output_input",
        "output_id": "main-out"
      },
      "channel_matrix": {
        "ll": 1.0,
        "lr": 0.0,
        "rl": 0.0,
        "rr": 1.0
      },
      "gain_db": 0.0,
      "mute": false,
      "follows_mute": false
    },
    {
      "id": "t2-main",
      "source": {
        "kind": "track",
        "track_id": "t2",
        "tap": "post_pan"
      },
      "destination": {
        "kind": "output_input",
        "output_id": "main-out"
      },
      "channel_matrix": {
        "ll": 1.0,
        "lr": 0.0,
        "rl": 0.0,
        "rr": 1.0
      },
      "gain_db": 0.0,
      "mute": false,
      "follows_mute": false
    }
  ],
  "automation": []
}
